/notebooks/Audio1/55.wav,Long screen exposure at work
/notebooks/Audio1/56.wav,Computer Vision Syndrome
/notebooks/Audio1/92.wav,Turkish President Recep
/notebooks/Audio1/93.wav,Time has come to make a Brexit choice
/notebooks/Audio1/94.wav,PM Modi to focus on maritime relations
/notebooks/Audio1/95.wav,South Africa's ANC holds crunch talks
/notebooks/Audio1/96.wav,speech sparks backlash
/notebooks/Audio1/97.wav,UK Man With Autism Accused Of Hacking FBI
/notebooks/Audio1/98.wav,Pakistani journalist covers his own wedding
/notebooks/Audio1/99.wav,US begins reducing troops in Iraq
